{
  "$schema": "../../../engine/schemas/strategy-brief.schema.json",
  "metadata": {
    "step": 1,
    "artifact": "strategy-brief",
    "pipeline_id": "pipeline-20260223",
    "created_at": "2026-02-23T01:15:00Z",
    "source_document": "index.html",
    "source_title": "Memorándum de Política Pública · Mercados Privados de Capital · Chile 2026",
    "source_reference": "MPP-2026-001",
    "author": "Andrés Prats — Socio Fundador Cordada Asset Manager"
  },

  "domain": {
    "name": "Plataforma de Infraestructura para Mercados Privados de Capital — Chile",
    "description": "Sistema de software que implementa la separación funcional entre gestión (GP), administración (Fund Admin) y custodia (Custodio Regulado) para fondos de inversión en mercados privados chilenos. El sistema habilita verificación independiente de valorización, existencia de activos y flujos de caja — la infraestructura que hoy no existe y que impide el crecimiento del mercado.",
    "industry": "Asset Management / Private Capital Markets",
    "geography": "Chile (con referencia comparada a Luxemburgo, EE.UU., UK, Colombia, Perú, México)",
    "regulatory_framework": [
      "LUF 20.712 (Ley Única de Fondos — Chile)",
      "DL 3.538 arts. 5 y 12 (facultades normativas CMF)",
      "AIFMD 2011/61/UE art. 21 (depositario — Luxemburgo)",
      "CSSF Circular 22/811 (Fund Admin delegatario)",
      "Advisers Act 1940 / Custody Rule 206(4)-2 (SEC — EE.UU.)",
      "Ley 21.595 (Ley de Delitos Económicos — Chile)",
      "ILPA Reporting Template 3.0"
    ]
  },

  "strategic_vision": {
    "thesis": "Chile tiene USD 400.000M en ahorro administrado y cero infraestructura independiente de mercados privados. Quien gestiona es el mismo que valora los activos, confirma que existen y controla los flujos. Sin separación funcional, no hay mercado. La barrera no es regulación ni voluntad — es la ausencia de los tres actores independientes que todo mercado desarrollado tiene: GP, Fund Admin y Custodio Regulado.",
    "problem_statement": {
      "summary": "En mercados privados chilenos, un solo actor (la AGF) cumple simultáneamente las funciones de gestión, administración, cálculo de NAV, verificación de activos y monitoreo de flujos — sobre sí mismo. No existe circuito independiente de control.",
      "three_core_problems": [
        {
          "id": "P1",
          "name": "Valorización sin verificación",
          "description": "La AGF estima el valor de activos que ella misma originó y cobra comisiones sobre ese valor. No existe verificación independiente del NAV.",
          "public_market_analog": "En mercados públicos, el precio es la última transacción entre comprador y vendedor — un hecho observable por todos."
        },
        {
          "id": "P2",
          "name": "Existencia del activo no verificada",
          "description": "La AGF declara existencia de activos. Nadie verifica que el contrato exista ni en qué estado se encuentra.",
          "public_market_analog": "En mercados públicos, los valores están en registro electrónico del DCV. Titularidad verificable en tiempo real."
        },
        {
          "id": "P3",
          "name": "Flujos de caja sin monitoreo independiente",
          "description": "La AGF controla inversiones y flujos simultáneamente. Nadie monitorea que correspondan al mandato del fondo.",
          "public_market_analog": "En mercados públicos, la cámara de compensación liquida transacciones con margin diario y sistema independiente."
        }
      ]
    },
    "solution": {
      "summary": "Separación funcional entre gestión (GP), administración (Fund Admin) y custodia (Custodio Regulado) — el estándar que Luxemburgo, EE.UU. y UK ya tienen. Chile sería el primero en América Latina con separación funcional completa.",
      "three_actors": [
        {
          "role": "GP (General Partner / Gestor)",
          "responsibilities": [
            "Decisiones de inversión",
            "Construcción de cartera",
            "Gestión de riesgos",
            "Responsabilidad fiduciaria indelegable",
            "Cumplimiento del mandato prometido"
          ],
          "liability": "Plena e indelegable"
        },
        {
          "role": "Fund Administrator",
          "responsibilities": [
            "Cálculo del NAV",
            "Registro de aportantes",
            "Distribuciones",
            "Contabilidad del fondo",
            "Verificación de Reglamento Interno",
            "Reporte a CMF en su perímetro"
          ],
          "liability": "Acotada y asegurable"
        },
        {
          "role": "Custodio Regulado",
          "responsibilities": [
            "Verificación de existencia de activos",
            "Verificación de titularidad y estado",
            "Supervisión de flujos de efectivo",
            "Reporte autónomo a CMF sin consultar al GP ni al Fund Admin"
          ],
          "liability": "Independencia verificadora con reporte autónomo"
        }
      ]
    }
  },

  "evidence": {
    "caso_sartor": {
      "summary": "Entre 2020 y 2024, Sartor AGF canalizó +CLP 100.000MM en créditos hacia empresas relacionadas a través de fondos públicos. Estados financieros falsificados durante 4 períodos consecutivos. Pérdidas superiores al 85% del valor patrimonial en algunos fondos.",
      "sanctions": "367.500 UF (sanción más severa en la historia de la CMF) + revocación de existencia + derivación al Ministerio Público bajo Ley 21.595",
      "source": "CMF, Resolución Exenta N° 10.950, Procedimiento Sancionatorio Sartor AGF S.A., 2024",
      "failures_mapped_to_problems": [
        {
          "failure": "El gestor calculó el NAV que él mismo deterioró",
          "maps_to": "P1 — Valorización sin verificación",
          "detail": "Sartor calculó el valor de cuotas sobre activos que él mismo había comprometido en créditos a partes relacionadas, sin verificación externa durante cuatro períodos."
        },
        {
          "failure": "Activos declarados, nunca verificados",
          "maps_to": "P2 — Existencia del activo no verificada",
          "detail": "El 80% del Fondo Sartor Táctico estaba invertido en pagarés emitidos por personas vinculadas a la administradora. Ningún actor independiente verificó existencia ni titularidad."
        },
        {
          "failure": "Cartera y tesorería controladas por el mismo actor",
          "maps_to": "P3 — Flujos de caja sin monitoreo",
          "detail": "Sartor controló simultáneamente las inversiones y los flujos del fondo. El descalce entre promesas de rescate y activos ilíquidos fue cubierto con nuevas captaciones."
        },
        {
          "failure": "El gestor verificó su propio cumplimiento del mandato",
          "maps_to": "P1+P2+P3 — Un actor, tres funciones, cero verificación",
          "detail": "Sartor era árbitro único de su propio cumplimiento del reglamento interno. No existía ningún actor externo con mandato legal ni incentivo económico para detectar las irregularidades."
        }
      ]
    },
    "key_statistics": [
      {
        "metric": "USD 400.000M",
        "description": "Ahorro administrado total en Chile (AFPs ~210.000M, seguros de vida ~85.000M, fondos mutuos ~65.000M, fondos alternativos ~40.000M)",
        "source": "SP, CMF, Banco Central, ACAFI — cifras diciembre 2025"
      },
      {
        "metric": "USD 5.000M",
        "description": "Deuda privada en Chile — un mercado real sin verificación independiente",
        "source": "ACAFI, Q4 2025"
      },
      {
        "metric": "83%",
        "description": "Del financiamiento empresarial concentrado en banca. Los mercados privados son aún de nicho.",
        "source": "CMF, IEF 2S 2025"
      },
      {
        "metric": "0",
        "description": "Fund Administrators independientes autorizados en Chile hoy (vs 150+ en Luxemburgo, 80+ en Irlanda, 3 en Colombia)",
        "source": "CMF, Registro de Entidades Supervisadas"
      },
      {
        "metric": "USD 320.000M",
        "description": "PIB nominal de Chile 2025",
        "source": "Banco Central de Chile, Cuentas Nacionales"
      },
      {
        "metric": "3–7 bps",
        "description": "Costo de Fund Admin global sobre AUM. Para fondo de USD 100M = USD 30.000–70.000 anuales",
        "source": "EFAMA/Monterone Partners, Fund Administration Industry Survey 2024"
      },
      {
        "metric": "USD 8.000–12.000M",
        "description": "Capital adicional estimado si Chile captura 1% del flujo global de alternativos hacia LatAm en la próxima década",
        "source": "Estimación del autor basada en Preqin Global Alternatives Report 2025"
      }
    ],
    "comparative_analysis": {
      "chile": {
        "framework": "LUF 20.712",
        "model": "AGF todo-en-uno. Gestión + administración + custodia concentradas. Sin separación funcional. Sin categoría jurídica de Fund Admin.",
        "fund_admins": 0
      },
      "luxemburgo": {
        "framework": "AIFMD 2011/61/UE, transpuesta 2013",
        "model": "AFM autorizado CSSF. Separación funcional obligatoria. Depositario obligatorio con responsabilidad objetiva (art. 21). Reporte autónomo a CSSF.",
        "fund_admins": "150+"
      },
      "eeuu": {
        "framework": "Advisers Act 1940 / Custody Rule 206(4)-2",
        "model": "Investment Adviser registrado SEC. Qualified Custodian obligatorio. Examen sorpresa PCAOB. Custodio comunica directamente a inversores.",
        "fund_admins": "industria desarrollada"
      },
      "latam_peers": {
        "colombia": "3 Fund Admins autorizados por SFC (Deceval, Fiduciaria Bancolombia, Cititrust)",
        "peru": "SBS permite delegación parcial de funciones operacionales bajo marco de fondos de inversión",
        "mexico": "CNBV contempla servicios de administración por terceros bajo Ley de Fondos de Inversión"
      }
    }
  },

  "roadmap": {